{
  "$schema": "./few-shot-examples.schema.json",
  "version": "1.0.0",
  "lastUpdated": "2025-12-27",
  "description": "Few-shot learning examples for RCA agent to improve solution quality",
  "categories": {
    "gradle": {
      "description": "Gradle build system errors including dependency resolution, version conflicts, and plugin issues",
      "examples": [
        {
          "id": "gradle-001",
          "title": "AGP Version Not Found",
          "errorType": "GRADLE_DEPENDENCY",
          "errorMessage": "Could not find com.android.tools.build:gradle:8.10.0",
          "filePath": "gradle/libs.versions.toml",
          "lineNumber": 5,
          "context": {
            "buildTool": "Gradle",
            "language": "Kotlin",
            "framework": "Android"
          },
          "analysis": {
            "problem": "Gradle cannot download Android Gradle Plugin (AGP) version 8.10.0 from Maven Central",
            "rootCause": "AGP version 8.10.0 does not exist. The 8.x series skips 8.8.x, 8.9.x, and 8.10.x versions. Valid stable versions in the 8.x series are 8.0.0 through 8.7.3, with the next stable being 9.0.0.",
            "evidence": [
              "Maven Central query shows no 8.10.0 artifact",
              "Version database confirms 8.7.3 is latest stable 8.x",
              "Version numbering jumps from 8.7.x to 9.0.x"
            ]
          },
          "solution": {
            "summary": "Update AGP version to valid stable release",
            "steps": [
              "Open gradle/libs.versions.toml in your project root",
              "Locate the agp version declaration (line 5)",
              "Change version from 8.10.0 to 8.7.3 (latest stable 8.x)",
              "Sync Gradle to apply changes"
            ],
            "codeChange": {
              "file": "gradle/libs.versions.toml",
              "lineNumber": 5,
              "before": "agp = \"8.10.0\"",
              "after": "agp = \"8.7.3\"",
              "explanation": "8.7.3 is the latest stable version in the 8.x series, released November 2024. It's compatible with Kotlin 1.9.0+ and Gradle 8.2+"
            },
            "verification": [
              "Run './gradlew --version' to confirm AGP version",
              "Run './gradlew build' to verify build succeeds",
              "Check that no version-related warnings appear"
            ],
            "alternatives": [
              {
                "version": "9.0.0",
                "pros": "Latest stable release with newest features",
                "cons": "Requires Kotlin 2.0.0+ and Gradle 8.9+",
                "migrationRequired": true
              },
              {
                "version": "8.6.0",
                "pros": "Widely tested, very stable",
                "cons": "Missing some bug fixes from 8.7.x",
                "migrationRequired": false
              }
            ]
          },
          "confidence": 95,
          "tags": ["gradle", "agp", "version-not-found", "dependency"]
        },
        {
          "id": "gradle-002",
          "title": "Kotlin Version Compatibility Issue",
          "errorType": "GRADLE_COMPATIBILITY",
          "errorMessage": "The current Gradle version 7.5 is not compatible with Kotlin Gradle Plugin 2.0.0",
          "filePath": "build.gradle.kts",
          "lineNumber": 10,
          "context": {
            "buildTool": "Gradle",
            "gradleVersion": "7.5",
            "kotlinVersion": "2.0.0",
            "language": "Kotlin"
          },
          "analysis": {
            "problem": "Gradle 7.5 cannot work with Kotlin 2.0.0",
            "rootCause": "Kotlin 2.0.0 requires Gradle 8.5 or higher due to new K2 compiler architecture. Gradle 7.x series is not compatible with Kotlin 2.x.",
            "evidence": [
              "Compatibility matrix shows Kotlin 2.0.0 requires Gradle 8.5+",
              "Gradle 7.5 released before Kotlin 2.0.0 existed",
              "K2 compiler uses new Gradle APIs not available in 7.x"
            ]
          },
          "solution": {
            "summary": "Upgrade Gradle to version 8.5 or higher",
            "steps": [
              "Open gradle/wrapper/gradle-wrapper.properties",
              "Update distributionUrl to Gradle 8.9 (latest stable)",
              "Run './gradlew wrapper --gradle-version=8.9' to update wrapper",
              "Sync Gradle and rebuild project"
            ],
            "codeChange": {
              "file": "gradle/wrapper/gradle-wrapper.properties",
              "lineNumber": 3,
              "before": "distributionUrl=https\\://services.gradle.org/distributions/gradle-7.5-bin.zip",
              "after": "distributionUrl=https\\://services.gradle.org/distributions/gradle-8.9-bin.zip",
              "explanation": "Gradle 8.9 is the latest stable version compatible with Kotlin 2.0.0 and provides optimal performance for K2 compiler"
            },
            "verification": [
              "Run './gradlew --version' to confirm Gradle 8.9",
              "Run './gradlew build' to verify compilation succeeds",
              "Check that K2 compiler warnings/errors are resolved"
            ],
            "alternatives": [
              {
                "version": "8.5",
                "pros": "Minimum required version, well-tested",
                "cons": "Missing performance improvements from 8.6+",
                "migrationRequired": false
              },
              {
                "version": "Kotlin 1.9.24",
                "pros": "Works with Gradle 7.5 (no Gradle upgrade needed)",
                "cons": "Doesn't get K2 compiler benefits",
                "migrationRequired": false,
                "note": "Alternative if Gradle upgrade is not feasible"
              }
            ]
          },
          "confidence": 98,
          "tags": ["gradle", "kotlin", "compatibility", "version-mismatch"]
        },
        {
          "id": "gradle-003",
          "title": "Dependency Resolution Failure - Transitive Conflict",
          "errorType": "GRADLE_DEPENDENCY",
          "errorMessage": "Conflict with dependency 'androidx.compose.ui:ui' in project ':app'. Resolved versions for app (1.6.0) and test app (1.5.0) differ.",
          "filePath": "app/build.gradle.kts",
          "lineNumber": 45,
          "context": {
            "buildTool": "Gradle",
            "language": "Kotlin",
            "framework": "Jetpack Compose"
          },
          "analysis": {
            "problem": "Multiple Compose UI versions are pulled by different dependencies, causing conflict",
            "rootCause": "App dependencies request Compose 1.6.0, but a test library transitively depends on Compose 1.5.0. Gradle cannot resolve which version to use.",
            "evidence": [
              "Dependency tree shows androidx.compose.ui:ui:1.6.0 from implementation",
              "Test dependency androidx.compose.ui:ui-test-junit4:1.5.0 pulls ui:1.5.0",
              "Gradle requires all versions of same library to match"
            ]
          },
          "solution": {
            "summary": "Force resolution to single Compose version using BOM (Bill of Materials)",
            "steps": [
              "Open app/build.gradle.kts",
              "Add Compose BOM to dependencies section",
              "Remove explicit version numbers from Compose dependencies",
              "BOM will enforce consistent versions across all Compose libraries"
            ],
            "codeChange": {
              "file": "app/build.gradle.kts",
              "lineNumber": 45,
              "before": "dependencies {\n    implementation(\"androidx.compose.ui:ui:1.6.0\")\n    implementation(\"androidx.compose.material3:material3:1.2.0\")\n    androidTestImplementation(\"androidx.compose.ui:ui-test-junit4:1.5.0\")\n}",
              "after": "dependencies {\n    // Compose BOM enforces consistent versions\n    implementation(platform(\"androidx.compose:compose-bom:2024.02.00\"))\n    implementation(\"androidx.compose.ui:ui\")\n    implementation(\"androidx.compose.material3:material3\")\n    androidTestImplementation(\"androidx.compose.ui:ui-test-junit4\")\n}",
              "explanation": "Compose BOM 2024.02.00 includes Compose UI 1.6.0 and ensures all Compose dependencies use compatible versions. Remove explicit version numbers to let BOM manage them."
            },
            "verification": [
              "Run './gradlew app:dependencies' to see resolved versions",
              "Verify all androidx.compose.* libraries show same version",
              "Run './gradlew build' to confirm conflict is resolved",
              "Run unit and instrumentation tests to ensure compatibility"
            ],
            "alternatives": [
              {
                "approach": "Force resolution without BOM",
                "code": "configurations.all {\n    resolutionStrategy {\n        force(\"androidx.compose.ui:ui:1.6.0\")\n    }\n}",
                "pros": "Simpler if only one library conflicts",
                "cons": "Doesn't prevent future conflicts, manual version management",
                "migrationRequired": false
              }
            ]
          },
          "confidence": 92,
          "tags": ["gradle", "compose", "dependency-conflict", "transitive"]
        },
        {
          "id": "gradle-004",
          "title": "Plugin Version Mismatch",
          "errorType": "GRADLE_PLUGIN",
          "errorMessage": "Plugin [id: 'org.jetbrains.kotlin.android', version: '1.8.0'] was not found in any of the following sources",
          "filePath": "build.gradle.kts",
          "lineNumber": 8,
          "context": {
            "buildTool": "Gradle",
            "kotlinVersion": "1.8.0",
            "language": "Kotlin"
          },
          "analysis": {
            "problem": "Gradle cannot find Kotlin Android plugin version 1.8.0",